{
  "$schema": "https://json-schema.org/draft/2020-12/schema",
  "$id": "https://calais-open-commons.invalid/schemas/listing.schema.json",
  "title": "Calais Open Commons listing",
  "type": "object",
  "additionalProperties": false,
  "required": [
    "id",
    "name",
    "categories",
    "audience",
    "location",
    "contact",
    "source",
    "verification",
    "publishable"
  ],
  "properties": {
    "id": {
      "type": "string",
      "pattern": "^[a-z0-9]+(?:-[a-z0-9]+)*$"
    },
    "name": {
      "type": "string",
      "minLength": 1
    },
    "categories": {
      "type": "array",
      "minItems": 1,
      "uniqueItems": true,
      "items": {
        "enum": [
          "emergency",
          "food",
          "showers",
          "water",
          "healthcare",
          "community",
          "legal",
          "orientation",
          "language_tandem",
          "phone_clinic",
          "bike_commons",
          "day_laundry",
          "quiet_space",
          "clothing_swap",
          "asso_cooking",
          "day_centre"
        ]
      }
    },
    "audience": {
      "type": "array",
      "minItems": 1,
      "uniqueItems": true,
      "items": {
        "enum": [
          "all",
          "men",
          "women_children",
          "minors",
          "detained"
        ]
      }
    },
    "location": {
      "type": "object",
      "additionalProperties": false,
      "required": [
        "label",
        "coordinates",
        "map_url"
      ],
      "properties": {
        "label": {
          "type": "string",
          "minLength": 1
        },
        "coordinates": {
          "anyOf": [
            {
              "type": "null"
            },
            {
              "type": "array",
              "prefixItems": [
                {
                  "type": "number",
                  "minimum": -180,
                  "maximum": 180
                },
                {
                  "type": "number",
                  "minimum": -90,
                  "maximum": 90
                }
              ],
              "items": false
            }
          ]
        },
        "map_url": {
          "type": [
            "string",
            "null"
          ],
          "format": "uri"
        },
        "address": {
          "type": "string",
          "minLength": 1
        },
        "landmark": {
          "type": "string",
          "minLength": 1
        }
      }
    },
    "contact": {
      "type": "object"
    },
    "source": {
      "type": "object",
      "additionalProperties": false,
      "required": [
        "title",
        "page",
        "notes"
      ],
      "properties": {
        "title": {
          "type": "string",
          "minLength": 1
        },
        "page": {
          "type": "integer",
          "minimum": 1
        },
        "notes": {
          "type": "string",
          "minLength": 1
        }
      }
    },
    "verification": {
      "type": "object",
      "additionalProperties": false,
      "required": [
        "status",
        "checked_at",
        "expires_at",
        "owner"
      ],
      "properties": {
        "status": {
          "enum": [
            "unverified",
            "verified",
            "suspended",
            "expired"
          ]
        },
        "checked_at": {
          "type": [
            "string",
            "null"
          ],
          "format": "date-time"
        },
        "expires_at": {
          "type": [
            "string",
            "null"
          ],
          "format": "date-time"
        },
        "owner": {
          "type": [
            "string",
            "null"
          ]
        },
        "verified_by": {
          "type": [
            "string",
            "null"
          ]
        },
        "method": {
          "anyOf": [
            {
              "type": "null"
            },
            {
              "enum": [
                "on_site",
                "phone",
                "provider",
                "written"
              ]
            }
          ]
        }
      }
    },
    "publishable": {
      "type": "boolean"
    },
    "tags": {
      "type": "array",
      "uniqueItems": true,
      "items": {
        "type": "string",
        "minLength": 1
      },
      "default": []
    },
    "hours": {
      "type": "array",
      "items": {
        "type": "object",
        "additionalProperties": false,
        "required": [
          "days",
          "opens",
          "closes"
        ],
        "properties": {
          "days": {
            "type": "string",
            "minLength": 1
          },
          "opens": {
            "type": "string",
            "pattern": "^([01]\\d|2[0-3]):[0-5]\\d$"
          },
          "closes": {
            "type": "string",
            "pattern": "^([01]\\d|2[0-3]):[0-5]\\d$"
          }
        }
      }
    }
  }
}
