[
  {
    "id": "roundabout-1",
    "name": "Roundabout 1",
    "categories": [
      "food"
    ],
    "audience": [
      "all",
      "women_children"
    ],
    "location": {
      "label": "50.941293, 1.898737",
      "coordinates": [
        1.898737,
        50.941293
      ],
      "map_url": "https://www.openstreetmap.org/?mlat=50.941293&mlon=1.898737"
    },
    "contact": {},
    "source": {
      "title": "New Arrival Guide (Infos für Neue, NAG), German edition by CHIP, October 2026 — extracted 2026-10-19",
      "page": 1,
      "notes": "Breakfast 10:15 and meal 14:00 daily (La Vie Active). Salam breakfast daily, stop 5. Women and children: shower pick-up from 14:00."
    },
    "verification": {
      "status": "unverified",
      "checked_at": null,
      "expires_at": null,
      "owner": null
    },
    "publishable": false
  },
  {
    "id": "english-toilet",
    "name": "English Toilet / Bd des Justes",
    "categories": [
      "food",
      "water",
      "community",
      "healthcare"
    ],
    "audience": [
      "all",
      "men",
      "women_children",
      "minors"
    ],
    "location": {
      "label": "50.943076, 1.899636",
      "coordinates": [
        1.899636,
        50.943076
      ],
      "map_url": "https://www.openstreetmap.org/?mlat=50.943076&mlon=1.899636"
    },
    "contact": {},
    "source": {
      "title": "New Arrival Guide (Infos für Neue, NAG), German edition by CHIP, October 2026 — extracted 2026-10-19",
      "page": 1,
      "notes": "Food Mon–Fri 15:45–17:00 (RCK). Clothes (Care4Calais): Tue 14:00–17:00 women and children only; Sat 14:00–17:00 men only. Charging and Wi-Fi: CHIP Mon, Fri 10:30–13:00, Wed 14:30–16:30, Thu 10:30–16:30; Secours Catholique Tue 10:00–12:00; Care4Calais Tue, Thu, Sat 14:00–17:00 (haircuts, hot drinks); Red Cross Wed 11:00–13:00 (bike repair, calls). MSF mental-health workshop Tue 10:30–12:00. FAST first aid Tue, Sat 14:00–16:30 (+33 7 66 04 92 98). Red Cross family links Wed 10:45–12:45. Kaleidoscope (under 18) Fri 11:00–13:00. CFC water container. Toilet."
    },
    "verification": {
      "status": "unverified",
      "checked_at": null,
      "expires_at": null,
      "owner": null
    },
    "publishable": false
  },
  {
    "id": "auchan-coquelles",
    "name": "Auchan Coquelles / rue de Bergnieulles",
    "categories": [
      "food",
      "showers",
      "water"
    ],
    "audience": [
      "all",
      "men",
      "women_children"
    ],
    "location": {
      "label": "50.945500, 1.805917",
      "coordinates": [
        1.805917,
        50.9455
      ],
      "map_url": "https://www.openstreetmap.org/?mlat=50.945500&mlon=1.805917"
    },
    "contact": {},
    "source": {
      "title": "New Arrival Guide (Infos für Neue, NAG), German edition by CHIP, October 2026 — extracted 2026-10-19",
      "page": 1,
      "notes": "Food daily 09:00–11:00, 14:00–16:30; water daily 09:00–11:30, 14:00–16:00 (La Vie Active). Men's shower bus Mon–Fri 08:30–12:00. Women and children: shower pick-up from 14:00."
    },
    "verification": {
      "status": "unverified",
      "checked_at": null,
      "expires_at": null,
      "owner": null
    },
    "publishable": false
  },
  {
    "id": "rue-des-mouettes",
    "name": "Rue des Mouettes",
    "categories": [
      "food"
    ],
    "audience": [
      "all",
      "women_children"
    ],
    "location": {
      "label": "50.965902, 1.899407",
      "coordinates": [
        1.899407,
        50.965902
      ],
      "map_url": "https://www.openstreetmap.org/?mlat=50.965902&mlon=1.899407"
    },
    "contact": {},
    "source": {
      "title": "New Arrival Guide (Infos für Neue, NAG), German edition by CHIP, October 2026 — extracted 2026-10-19",
      "page": 1,
      "notes": "Food daily 09:00–11:00, 14:00–16:00 (La Vie Active). Salam breakfast daily, stop 4. Women and children: shower pick-up from 14:00."
    },
    "verification": {
      "status": "unverified",
      "checked_at": null,
      "expires_at": null,
      "owner": null
    },
    "publishable": false
  },
  {
    "id": "rue-des-huttes",
    "name": "Rue des Huttes",
    "categories": [
      "food",
      "showers",
      "water",
      "community",
      "healthcare"
    ],
    "audience": [
      "all",
      "men",
      "women_children"
    ],
    "location": {
      "label": "50.964782 / 50.966028, 1.895543 / 1.894917",
      "coordinates": null,
      "map_url": null
    },
    "contact": {},
    "source": {
      "title": "New Arrival Guide (Infos für Neue, NAG), German edition by CHIP, October 2026 — extracted 2026-10-19",
      "page": 1,
      "notes": "Water daily 09:00–11:00, 14:00–16:00 (La Vie Active). Men's shower bus Mon–Fri 08:30–12:00. Women and children: shower pick-up from 14:00. Salam breakfast daily, stop 3. CAES bus Mon–Fri 08:30, 'ZI des Dunes' stop. FAST first aid Thu."
    },
    "verification": {
      "status": "unverified",
      "checked_at": null,
      "expires_at": null,
      "owner": null
    },
    "publishable": false
  },
  {
    "id": "quai-de-la-meuse",
    "name": "Town Centre — Quai de la Meuse",
    "categories": [
      "food",
      "community"
    ],
    "audience": [
      "all"
    ],
    "location": {
      "label": "50.955764, 1.857071",
      "coordinates": [
        1.857071,
        50.955764
      ],
      "map_url": "https://www.openstreetmap.org/?mlat=50.955764&mlon=1.857071"
    },
    "contact": {},
    "source": {
      "title": "New Arrival Guide (Infos für Neue, NAG), German edition by CHIP, October 2026 — extracted 2026-10-19",
      "page": 1,
      "notes": "Food Mon, Wed, Fri 12:45–13:45 (RCK). Charging and Wi-Fi: CHIP Tue 14:30–16:30, Sat 11:00–15:30; Care4Calais Sun 14:00–17:00 (haircuts, hot drinks)."
    },
    "verification": {
      "status": "unverified",
      "checked_at": null,
      "expires_at": null,
      "owner": null
    },
    "publishable": false
  },
  {
    "id": "quai-de-la-moselle",
    "name": "Town Centre — Quai de la Moselle",
    "categories": [
      "food",
      "community",
      "healthcare"
    ],
    "audience": [
      "all"
    ],
    "location": {
      "label": "50.954868, 1.857705",
      "coordinates": [
        1.857705,
        50.954868
      ],
      "map_url": "https://www.openstreetmap.org/?mlat=50.954868&mlon=1.857705"
    },
    "contact": {},
    "source": {
      "title": "New Arrival Guide (Infos für Neue, NAG), German edition by CHIP, October 2026 — extracted 2026-10-19",
      "page": 1,
      "notes": "Clothes for everyone Sun 14:00–17:00 (Care4Calais, a full set every few weeks). FAST first aid Sun 14:00–16:30. Salam breakfast daily, stop 2."
    },
    "verification": {
      "status": "unverified",
      "checked_at": null,
      "expires_at": null,
      "owner": null
    },
    "publishable": false
  },
  {
    "id": "calais-station",
    "name": "Calais train station",
    "categories": [
      "food"
    ],
    "audience": [
      "all"
    ],
    "location": {
      "label": "50.953446, 1.851006",
      "coordinates": [
        1.851006,
        50.953446
      ],
      "map_url": "https://www.openstreetmap.org/?mlat=50.953446&mlon=1.851006"
    },
    "contact": {},
    "source": {
      "title": "New Arrival Guide (Infos für Neue, NAG), German edition by CHIP, October 2026 — extracted 2026-10-19",
      "page": 1,
      "notes": "Salam breakfast daily, stop 1 (blankets and hygiene items on request)."
    },
    "verification": {
      "status": "unverified",
      "checked_at": null,
      "expires_at": null,
      "owner": null
    },
    "publishable": false
  },
  {
    "id": "roundabout-2",
    "name": "Roundabout 2",
    "categories": [
      "water",
      "showers",
      "community",
      "legal"
    ],
    "audience": [
      "all",
      "men",
      "women_children"
    ],
    "location": {
      "label": "50.940186, 1.895820",
      "coordinates": [
        1.89582,
        50.940186
      ],
      "map_url": "https://www.openstreetmap.org/?mlat=50.940186&mlon=1.895820"
    },
    "contact": {},
    "source": {
      "title": "New Arrival Guide (Infos für Neue, NAG), German edition by CHIP, October 2026 — extracted 2026-10-19",
      "page": 1,
      "notes": "Water daily 09:00–11:30, 14:00–18:00 (La Vie Active; women's hygiene items and baby food on request). Men's shower bus Mon–Fri 08:30–12:00. Women and children: shower pick-up from 14:00. OFII outreach Tue morning (maraudes@ofii.fr)."
    },
    "verification": {
      "status": "unverified",
      "checked_at": null,
      "expires_at": null,
      "owner": null
    },
    "publishable": false
  },
  {
    "id": "pegasus",
    "name": "Pegasus",
    "categories": [
      "water",
      "healthcare"
    ],
    "audience": [
      "all"
    ],
    "location": {
      "label": "Public site; exact point must be verified",
      "coordinates": null,
      "map_url": null
    },
    "contact": {
      "phone": "+33605883819"
    },
    "source": {
      "title": "New Arrival Guide (Infos für Neue, NAG), German edition by CHIP, October 2026 — extracted 2026-10-19",
      "page": 1,
      "notes": "CFC water container (bring a jerrycan; if empty call +33 6 05 88 38 19). FAST first aid Thu."
    },
    "verification": {
      "status": "unverified",
      "checked_at": null,
      "expires_at": null,
      "owner": null
    },
    "publishable": false
  },
  {
    "id": "bmx-track-water-point",
    "name": "BMX track water point",
    "categories": [
      "water",
      "healthcare",
      "community"
    ],
    "audience": [
      "all"
    ],
    "location": {
      "label": "Public site; exact point must be verified",
      "coordinates": null,
      "map_url": null
    },
    "contact": {
      "phone": "+33605883819"
    },
    "source": {
      "title": "New Arrival Guide (Infos für Neue, NAG), German edition by CHIP, October 2026 — extracted 2026-10-19",
      "page": 1,